<?xml version="1.0" encoding="UTF-8" standalone="no"?>
<pao xmlns:xsi="http://www.w3.org/2001/XMLSchema-instance" paoType="RFN520FAX" changeGroup="meter" displayGroup="RFMESH" displayName="RFN-520fAX" xsi:noNamespaceSchemaLocation="../pao.xsd">
    <pointFiles>
        <pointFile>RFN.xml</pointFile>
    </pointFiles>
    <tags>
        <tag name="COMMANDER_REQUESTS"/>
        <tag name="DEVICE_CONFIGURATION"/>
        <tag name="DEVICE_ICON_TYPE" option="electric_meter"/>
        <tag name="METER_DETAIL_DISPLAYABLE"/>
        <tag name="NETWORK_MANAGER_ATTRIBUTE_READS"/>
        <tag name="OUTAGE"/>
        <tag name="RFN_DEMAND_RESET"/>
        <tag name="RFN_EVENTS"/>
        <tag name="RFN_POINT_CALCULATION"/>
        <tag name="SUPPORTS_ATTRIBUTE_ASSIGNMENT"/>
        <tag name="TOU"/>
        <tag name="USES_METER_NUMBER_FOR_MSP"/>
        <tag name="VOLTAGE_PROFILE"/>
    </tags>
    <configuration>
        <category type="rfnDemand" optional="true"/>
        <category type="demandFreeze"/>
        <category type="rfnChannelConfiguration"/>
        <category type="rfnMetrologyConfiguration" optional="true"/>
        <category type="rfnTempAlarm"/>
        <category type="rfnVoltage"/>
        <category type="tou"/>
    </configuration>
    <pointInfos>
        <pointInfo name="Avg Voltage" attributes="AVERAGE_VOLTAGE,AVERAGE_VOLTAGE_PHASE_A"/>
        <pointInfo name="Bad Upgrade Security Param" attributes="BAD_UPGRADE_SECURITY_PARAM"/>
        <pointInfo name="Blink Count" init="true" attributes="RFN_BLINK_COUNT"/>
        <pointInfo name="Blink Restore Count" init="true" attributes="RFN_BLINK_RESTORE_COUNT"/>
        <pointInfo name="Clock Error" attributes="CLOCK_ERROR"/>
        <pointInfo name="Current" attributes="CURRENT,CURRENT_PHASE_A"/>
        <pointInfo name="Daily Max Volts" init="true" attributes="MAXIMUM_VOLTAGE_DAILY"/>
        <pointInfo name="Daily Min Volts" init="true" attributes="MINIMUM_VOLTAGE_DAILY"/>
        <pointInfo name="Delivered kW" init="true" attributes="DELIVERED_DEMAND,DEMAND"/>
        <pointInfo name="Delivered kW Load Profile" attributes="LOAD_PROFILE,DELIVERED_KW_LOAD_PROFILE"/>
        <pointInfo name="Delivered kWh" init="true" attributes="USAGE,DELIVERED_KWH"/>
        <pointInfo name="Delivered kWh per Interval" init="true" attributes="DELIVERED_KWH_PER_INTERVAL"/>
        <pointInfo name="Demand Overload" attributes="DEMAND_OVERLOAD"/>
        <pointInfo name="Device Temperature" init="true" attributes="TEMPERATURE_DEVICE"/>
        <pointInfo name="Energy Accumulated While In Standby Mode" attributes="ENERGY_ACCUMULATED_WHILE_IN_STANDBY_MODE"/>
        <pointInfo name="Failed Upgrade Signature Verification" attributes="FAILED_UPGRADE_SIGNATURE_VERIF"/>
        <pointInfo name="Invalid Service" attributes="INVALID_SERVICE"/>
        <pointInfo name="Low Battery Warning" attributes="LOW_BATTERY_WARNING"/>
        <pointInfo name="Max Voltage" attributes="MAXIMUM_VOLTAGE_PHASE_A"/>
        <pointInfo name="Measurement Error" attributes="MEASUREMENT_ERROR"/>
        <pointInfo name="Min Voltage" attributes="MINIMUM_VOLTAGE_PHASE_A"/>
        <pointInfo name="Net kW Load Profile" attributes="NET_KW_LOAD_PROFILE"/>
        <pointInfo name="Net kWh" attributes="NET_KWH"/>
        <pointInfo name="Net kWh (Rate A kWh)" attributes="NET_KWH_RATE_A"/>
        <pointInfo name="Net kWh (Rate B kWh)" attributes="NET_KWH_RATE_B"/>
        <pointInfo name="Net kWh (Rate C kWh)" attributes="NET_KWH_RATE_C"/>
        <pointInfo name="Net kWh (Rate D kWh)" attributes="NET_KWH_RATE_D"/>
        <pointInfo name="Net kWh per Interval" attributes="NET_KWH_PER_INTERVAL"/>
        <pointInfo name="Non Volatile Mem Failure" attributes="NON_VOLATILE_MEM_FAILURE"/>
        <pointInfo name="Outage Count" init="true" attributes="RFN_OUTAGE_COUNT"/>
        <pointInfo name="Outage Restore Count" init="true" attributes="RFN_OUTAGE_RESTORE_COUNT"/>
        <pointInfo name="Outage Status" init="true" attributes="OUTAGE_STATUS"/>
        <pointInfo name="Outages" init="true" attributes="OUTAGE_LOG"/>
        <pointInfo name="Over Voltage" attributes="OVER_VOLTAGE"/>
        <pointInfo name="Peak Demand Daily" init="true" attributes="PEAK_DEMAND_DAILY"/>
        <pointInfo name="Peak kW" init="true" attributes="PEAK_DEMAND"/>
        <pointInfo name="Peak kW (Rate A kW)" init="true" attributes="PEAK_DEMAND_RATE_A"/>
        <pointInfo name="Peak kW (Rate B kW)" attributes="PEAK_DEMAND_RATE_B"/>
        <pointInfo name="Peak kW (Rate C kW)" attributes="PEAK_DEMAND_RATE_C"/>
        <pointInfo name="Peak kW (Rate D kW)" attributes="PEAK_DEMAND_RATE_D"/>
        <pointInfo name="Peak kW Frozen" attributes="PEAK_DEMAND_FROZEN"/>
        <pointInfo name="Peak kW Frozen (Rate A kW)" attributes="PEAK_DEMAND_FROZEN_RATE_A"/>
        <pointInfo name="Peak kW Frozen (Rate B kW)" attributes="PEAK_DEMAND_FROZEN_RATE_B"/>
        <pointInfo name="Peak kW Frozen (Rate C kW)" attributes="PEAK_DEMAND_FROZEN_RATE_C"/>
        <pointInfo name="Peak kW Frozen (Rate D kW)" attributes="PEAK_DEMAND_FROZEN_RATE_D"/>
        <pointInfo name="Power Failure" attributes="POWER_FAIL_FLAG"/>
        <pointInfo name="Ram Error" attributes="RAM_ERROR"/>
        <pointInfo name="Rate A kWh" init="true" attributes="USAGE_RATE_A"/>
        <pointInfo name="Rate B kWh" attributes="USAGE_RATE_B"/>
        <pointInfo name="Rate C kWh" attributes="USAGE_RATE_C"/>
        <pointInfo name="Rate D kWh" attributes="USAGE_RATE_D"/>
        <pointInfo name="Received kW Load Profile" attributes="RECEIVED_KW_LOAD_PROFILE"/>
        <pointInfo name="Received kWh" attributes="RECEIVED_KWH"/>
        <pointInfo name="Received kWh (Rate A kWh)" attributes="RECEIVED_KWH_RATE_A"/>
        <pointInfo name="Received kWh (Rate B kWh)" attributes="RECEIVED_KWH_RATE_B"/>
        <pointInfo name="Received kWh (Rate C kWh)" attributes="RECEIVED_KWH_RATE_C"/>
        <pointInfo name="Received kWh (Rate D kWh)" attributes="RECEIVED_KWH_RATE_D"/>
        <pointInfo name="Received kWh per Interval" attributes="RECEIVED_KWH_PER_INTERVAL"/>
        <pointInfo name="Reverse Rotation" attributes="REVERSE_POWER_FLAG"/>
        <pointInfo name="RF Demand Reset Status" init="true" attributes="RF_DEMAND_RESET_STATUS"/>
        <pointInfo name="RFN High Temperature Threshold Exceeded" attributes="RFN_TEMPERATURE_ALARM"/>
        <pointInfo name="Rom Error" attributes="ROM_ERROR"/>
        <pointInfo name="Service Disconnect Switch Error" attributes="SERVICE_DISCONNECT_SWITCH_ERROR"/>
        <pointInfo name="Service Disconnect Switch Sensor Error" attributes="SERVICE_DISCONNECT_SWITCH_SENSOR_ERROR"/>
        <pointInfo name="Stuck Switch" attributes="STUCK_SWITCH"/>
        <pointInfo name="Sum kW Load Profile" attributes="SUM_KW_LOAD_PROFILE"/>
        <pointInfo name="Sum kWh" init="true" attributes="SUM_KWH"/>
        <pointInfo name="Sum kWh (Rate A kWh)" attributes="SUM_KWH_RATE_A"/>
        <pointInfo name="Sum kWh (Rate B kWh)" attributes="SUM_KWH_RATE_B"/>
        <pointInfo name="Sum kWh (Rate C kWh)" attributes="SUM_KWH_RATE_C"/>
        <pointInfo name="Sum kWh (Rate D kWh)" attributes="SUM_KWH_RATE_D"/>
        <pointInfo name="Sum kWh per Interval" attributes="SUM_KWH_PER_INTERVAL"/>
        <pointInfo name="Tamper Detect" attributes="TAMPER_FLAG"/>
        <pointInfo name="Tamper - No Usage over 24 hours" attributes="TAMPER_NO_USAGE_OVER_24_HOURS"/>
        <pointInfo name="Tamper - Reverse Wh Detected" attributes="TAMPER_REVERSE_WH_DETECTED"/>
        <pointInfo name="Tamper - Large Increase After Outage" attributes="TAMPER_LARGE_INCREASE_AFTER_OUTAGE"/>
        <pointInfo name="Tamper - Large Decrease After Outage" attributes="TAMPER_LARGE_DECREASE_AFTER_OUTAGE"/>
        <pointInfo name="Time Adjustment" attributes="TIME_ADJUSTMENT"/>
        <pointInfo name="Total Outage Count" init="true" attributes="BLINK_COUNT"/>
        <pointInfo name="TOU Schedule Change" attributes="TOU_SCHEDULE_CHANGE"/>
        <pointInfo name="Ultra Capacitor Bad" attributes="ULTRA_CAPACITOR_BAD"/>
        <pointInfo name="Unconfigured" attributes="UNCONFIGURED"/>
        <pointInfo name="Under Voltage" attributes="UNDER_VOLTAGE"/>
        <pointInfo name="Unprogrammed" attributes="UNPROGRAMMED"/>
        <pointInfo name="User Programmable Temperature Threshold Exceeded" attributes="USER_PROGRAMMABLE_TEMPERATURE_THRESHOLD_EXCEEDED"/>
        <pointInfo name="Vibration or Tilt or Insertion - Tamper Detect" attributes="VIBRATION_TILT_TAMPER_DETECTED"/>
        <pointInfo name="Voltage" init="true" attributes="VOLTAGE,VOLTAGE_PROFILE"/>
        <pointInfo name="Voltage (Single Phase)" attributes="VOLTAGE_PHASE_A"/>
        <pointInfo name="Voltage Alerts" attributes="VOLTAGE_ALERTS"/>
        <pointInfo name="Voltage Phase A Out" attributes="VOLTAGE_PHASE_A_OUT"/>
        <pointInfo name="Voltage Phase B Out" attributes="VOLTAGE_PHASE_B_OUT"/>
        <pointInfo name="Voltage Phase C Out" attributes="VOLTAGE_PHASE_C_OUT"/>
        <pointInfo name="Voltage Phase Error" attributes="VOLTAGE_PHASE_ERROR"/>
        <pointInfo name="Received kW" attributes="RECEIVED_DEMAND"/>
        <pointInfo name="Received Peak kW" attributes="RECEIVED_PEAK_DEMAND"/>
        <pointInfo name="Received Peak kW (Rate A kW)" attributes="RECEIVED_PEAK_DEMAND_RATE_A"/>
        <pointInfo name="Received Peak kW (Rate B kW)" attributes="RECEIVED_PEAK_DEMAND_RATE_B"/>
        <pointInfo name="Received Peak kW (Rate C kW)" attributes="RECEIVED_PEAK_DEMAND_RATE_C"/>
        <pointInfo name="Received Peak kW (Rate D kW)" attributes="RECEIVED_PEAK_DEMAND_RATE_D"/>
    </pointInfos>
</pao>