<?xml version="1.0" encoding="UTF-8" standalone="no"?>
<pao xmlns:xsi="http://www.w3.org/2001/XMLSchema-instance" paoType="REPEATER" changeGroup="repeater" displayGroup="Signal Transmitters" displayName="REPEATER 900" xsi:noNamespaceSchemaLocation="../pao.xsd">
    <pointFiles>
        <pointFile>TRANSMITTER.xml</pointFile>
    </pointFiles>
    <tags>
        <tag name="COMMANDER_REQUESTS"/>
        <tag name="DEVICE_ICON_TYPE" option="transmitter"/>
        <tag name="DLC_ADDRESS_RANGE_ENFORCE" option="464-4302,4190464-4194302"/>
        <tag name="LOCATE_ROUTE"/>
    </tags>
    <pointInfos>
        <pointInfo name="Comm Status" init="true" attributes="COMM_STATUS"/>
    </pointInfos>
</pao>
