<?xml version="1.0" encoding="UTF-8" standalone="no"?>
<pao xmlns:xsi="http://www.w3.org/2001/XMLSchema-instance" paoType="CAPBANKCONTROLLER" changeGroup="cap" displayGroup="Volt/Var" displayName="CBC Versacom" xsi:noNamespaceSchemaLocation="../pao.xsd">
    <pointFiles>
        <pointFile>CAP_CONTROL.xml</pointFile>
    </pointFiles>
    <tags>
        <tag name="COMMANDER_REQUESTS"/>
        <tag name="DLC_ADDRESS_RANGE" option="700000001-701000000"/>
        <tag name="ONE_WAY_DEVICE"/>
    </tags>
    <pointInfos>
        <pointInfo name="Capacitor Bank State" init="true" attributes="CONTROL_POINT"/>
    </pointInfos>
</pao>
