<?xml version="1.0" encoding="UTF-8" standalone="no"?>
<pao xmlns:xsi="http://www.w3.org/2001/XMLSchema-instance" paoType="MCT318" changeGroup="meter" creatable="false" displayGroup="MCT" displayName="MCT-318" xsi:noNamespaceSchemaLocation="../pao.xsd">
    <pointFiles>
        <pointFile>MCT31X.xml</pointFile>
    </pointFiles>
    <tags>
        <tag name="COMMANDER_REQUESTS"/>
        <tag name="DEVICE_ICON_TYPE" option="electric_meter"/>
        <tag name="DLC_ADDRESS_RANGE_ENFORCE" option="0-4194303"/>
        <tag name="LOCATE_ROUTE"/>
        <tag name="MCT_300_SERIES"/>
        <tag name="METER_DETAIL_DISPLAYABLE"/>
        <tag name="OUTAGE"/>
        <tag name="PORTER_COMMAND_REQUESTS"/>
        <tag name="STARS_ACCOUNT_ATTACHABLE_METER"/>
        <tag name="USES_METER_NUMBER_FOR_MSP"/>
    </tags>
    <pointInfos>
        <pointInfo name="Blink Count" init="true" attributes="BLINK_COUNT"/>
        <pointInfo name="Comm Status" attributes="COMM_STATUS"/>
        <pointInfo name="kW" init="true" attributes="DEMAND"/>
        <pointInfo name="kW (Channel 2)"/>
        <pointInfo name="kW (Channel 3)"/>
        <pointInfo name="kWh" init="true" attributes="USAGE"/>
        <pointInfo name="kWh (Channel 2)"/>
        <pointInfo name="kWh (Channel 3)"/>
        <pointInfo name="Max OR Off Peak Demand (Pulse Input 1)" attributes="PEAK_DEMAND"/>
        <pointInfo name="Max OR Off Peak Demand (Pulse Input 2)"/>
        <pointInfo name="Max OR Off Peak Demand (Pulse Input 3)"/>
        <pointInfo name="Min OR On Peak Demand (Pulse Input 1)"/>
        <pointInfo name="Min OR On Peak Demand (Pulse Input 2)"/>
        <pointInfo name="Min OR On Peak Demand (Pulse Input 3)"/>
        <pointInfo name="Outage Status" init="true" attributes="OUTAGE_STATUS"/>
        <pointInfo name="Over Flow Flag"/>
        <pointInfo name="Power Fail" init="true"/>
        <pointInfo name="Pulse Input #1 (Frozen)"/>
        <pointInfo name="Pulse Input #2 (Frozen)"/>
        <pointInfo name="Pulse Input #3 (Frozen)"/>
        <pointInfo name="Short Power Fail Flag"/>
        <pointInfo name="Status Input #2"/>
        <pointInfo name="Status Input #3"/>
        <pointInfo name="Status Input #4"/>
        <pointInfo name="Status Input #7"/>
        <pointInfo name="Status Input #8"/>
    </pointInfos>
    <commands>
        <command name="Read Blink Count">
            <cmd text="getvalue powerfail"/>
            <point name="Blink Count"/>
        </command>
        <command name="Read Current Demand">
            <cmd text="getvalue demand"/>
            <point name="kW"/>
        </command>
        <command name="Read Usage">
            <cmd text="getvalue kWh"/>
            <point name="kWh"/>
        </command>
    </commands>
</pao>
