<?xml version="1.0" encoding="UTF-8" standalone="no"?>
<pao xmlns:xsi="http://www.w3.org/2001/XMLSchema-instance" paoType="RFN440_2131TD" changeGroup="meter" creatable="false" displayGroup="RFMESH" displayName="RFN-440-2131TD" xsi:noNamespaceSchemaLocation="../pao.xsd">
    <pointFiles>
        <pointFile>RFN.xml</pointFile>
    </pointFiles>
    <tags>
        <tag name="DEVICE_ICON_TYPE" option="electric_meter"/>
        <tag name="DISCONNECT_RFN"/>
        <tag name="METER_DETAIL_DISPLAYABLE"/>
        <tag name="NETWORK_MANAGER_ATTRIBUTE_READS"/>
        <tag name="OUTAGE"/>
        <tag name="RFN_DEMAND_RESET"/>
        <tag name="RFN_EVENTS"/>
        <tag name="TOU"/>
        <tag name="USES_METER_NUMBER_FOR_MSP"/>
    </tags>
    <pointInfos>
        <pointInfo name="Amps Phase A" init="true" attributes="CURRENT_PHASE_A"/>
        <pointInfo name="Blink Count" init="true" attributes="RFN_BLINK_COUNT"/>
        <pointInfo name="Blink Restore Count" init="true" attributes="RFN_BLINK_RESTORE_COUNT"/>
        <pointInfo name="Current Angle Phase A" attributes="CURRENT_ANGLE_PHASE_A"/>
        <pointInfo name="Delivered kWh" init="true" attributes="USAGE"/>
        <pointInfo name="Delivered kWh per Interval" init="true" attributes="USAGE_PER_INTERVAL"/>
        <pointInfo name="Device Temperature" init="true" attributes="TEMPERATURE_DEVICE"/>
        <pointInfo name="Disconnect Status" init="true" attributes="DISCONNECT_STATUS"/>
        <pointInfo name="Forward Capacitive kVArh per Interval" init="true" attributes="FORWARD_CAPACITIVE_KVARH_PER_INTERVAL"/>
        <pointInfo name="Forward Inductive kVArh" init="true" attributes="FORWARD_INDUCTIVE_KVARH"/>
        <pointInfo name="Forward Inductive kVArh per Interval" init="true" attributes="FORWARD_INDUCTIVE_KVARH_PER_INTERVAL"/>
        <pointInfo name="Last Interval kW" init="true" attributes="DEMAND"/>
        <pointInfo name="Outage Count" init="true" attributes="RFN_OUTAGE_COUNT"/>
        <pointInfo name="Outage Restore Count" init="true" attributes="RFN_OUTAGE_RESTORE_COUNT"/>
        <pointInfo name="Outage Status" init="true" attributes="OUTAGE_STATUS"/>
        <pointInfo name="Outages" init="true" attributes="OUTAGE_LOG"/>
        <pointInfo name="Peak kW" init="true" attributes="PEAK_DEMAND"/>
        <pointInfo name="Rate A kWh" init="true" attributes="USAGE_RATE_A"/>
        <pointInfo name="Rate B kWh" init="true" attributes="USAGE_RATE_B"/>
        <pointInfo name="Rate C kWh" init="true" attributes="USAGE_RATE_C"/>
        <pointInfo name="Rate D kWh" init="true" attributes="USAGE_RATE_D"/>
        <pointInfo name="Received kWh" init="true" attributes="RECEIVED_KWH"/>
        <pointInfo name="Received kWh per Interval" attributes="RECEIVED_KWH_PER_INTERVAL"/>
        <pointInfo name="Reverse Capacitive kVArh per Interval" init="true" attributes="REVERSE_CAPACITIVE_KVARH_PER_INTERVAL"/>
        <pointInfo name="Reverse Inductive kVArh" init="true" attributes="REVERSE_INDUCTIVE_KVARH"/>
        <pointInfo name="Reverse Inductive kVArh per Interval" init="true" attributes="REVERSE_INDUCTIVE_KVARH_PER_INTERVAL"/>
        <pointInfo name="RF Demand Reset Status" init="true" attributes="RF_DEMAND_RESET_STATUS"/>
        <pointInfo name="RFN High Temperature Threshold Exceeded" attributes="RFN_TEMPERATURE_ALARM"/>
        <pointInfo name="Total Outage Count" init="true" attributes="BLINK_COUNT"/>
        <pointInfo name="Volts Phase A" init="true" attributes="VOLTAGE"/>
    </pointInfos>
</pao>
