<?xml version="1.0" encoding="UTF-8" standalone="no"?>
<pao xmlns:xsi="http://www.w3.org/2001/XMLSchema-instance" paoType="CBC_8020" changeGroup="cap2" displayGroup="Volt/Var" displayName="CBC 8020" xsi:noNamespaceSchemaLocation="../pao.xsd">
    <pointFiles>
        <pointFile>802X.xml</pointFile>
    </pointFiles>
    <tags>
        <tag name="COMMANDER_REQUESTS"/>
        <tag name="DEVICE_CONFIGURATION"/>
        <tag name="TWO_WAY_DEVICE"/>
    </tags>
    <configuration>
        <category type="dnp"/>
        <category type="cbcHeartbeat" />
        <category type="cbcAttributeMapping" optional="true"/>
    </configuration>
    <pointInfos>
        <pointInfo name="Abnormal Delta Voltage" init="true" attributes="VOLTAGE_DELTA_ABNORMAL"/>
        <pointInfo name="Adaptive kVAr Percent Bank Size"/>
        <pointInfo name="Auto Close Delay Time" init="true"/>
        <pointInfo name="Auto Control Mode" init="true"/>
        <pointInfo name="Average Line Voltage" init="true" attributes="VOLTAGE"/>
        <pointInfo name="Average Line Voltage Time" init="true"/>
        <pointInfo name="Bad Active Close Relay" init="true"/>
        <pointInfo name="Bad Active Trip Relay" init="true"/>
        <pointInfo name="Bank Control Time" init="true"/>
        <pointInfo name="Capacitor Bank State" init="true" attributes="CONTROL_POINT"/>
        <pointInfo name="CBC-8000 Hardware Type ID" init="true"/>
        <pointInfo name="Close Op Count" init="true" attributes="CLOSE_OPERATION_COUNT"/>
        <pointInfo name="Comms Loss OV Threshold" init="true"/>
        <pointInfo name="Comms Loss Time" init="true"/>
        <pointInfo name="Comms Loss UV Threshold" init="true"/>
        <pointInfo name="CVR Mode" init="true"/>
        <pointInfo name="CVR OV Threshold" init="true"/>
        <pointInfo name="CVR UV Threshold" init="true"/>
        <pointInfo name="Daily Control Limit" init="true"/>
        <pointInfo name="Delta Voltage" init="true"/>
        <pointInfo name="Device Reset Indicator" init="true"/>
        <pointInfo name="Door Sensor Damage/Tamper" init="true"/>
        <pointInfo name="Door Status" init="true"/>
        <pointInfo name="Emergency OV Threshold" init="true"/>
        <pointInfo name="Emergency UV Threshold" init="true"/>
        <pointInfo name="Enable SCADA Override" attributes="SCADA_OVERRIDE_ENABLE"/>
        <pointInfo name="Enable OVUV Control" attributes="ENABLE_OVUV_CONTROL"/>
        <pointInfo name="Enable Temperature Control" attributes="ENABLE_TEMPERATURE_CONTROL"/>
        <pointInfo name="Enable Time Control" attributes="ENABLE_TIME_CONTROL"/>
        <pointInfo name="Enable VAR Control" attributes="ENABLE_VAR_CONTROL"/>
        <pointInfo name="Firmware Version" init="true" attributes="FIRMWARE_VERSION"/>
        <pointInfo name="Firmware Major Version" attributes="FIRMWARE_VERSION_MAJOR"/>
        <pointInfo name="Firmware Minor Version" attributes="FIRMWARE_VERSION_MINOR"/>
        <pointInfo name="High Voltage" init="true"/>
        <pointInfo name="Ignore SCADA Override Time of Day"/>
        <pointInfo name="Ignored Control Reason" init="true" attributes="IGNORED_CONTROL_REASON"/>
        <pointInfo name="IP Address" init="true" attributes="IP_ADDRESS"/>
        <pointInfo name="Last Control Reason" init="true" attributes="LAST_CONTROL_REASON"/>
        <pointInfo name="Line Voltage High" init="true"/>
        <pointInfo name="Line Voltage Low" init="true"/>
        <pointInfo name="Line Voltage THD" init="true"/>
        <pointInfo name="Low Voltage" init="true"/>
        <pointInfo name="Manual Close Delay Time" init="true"/>
        <pointInfo name="Manual Control Mode" init="true" attributes="CONTROL_MODE"/>
        <pointInfo name="Max Operation Count" init="true"/>
        <pointInfo name="Neutral Lockout" init="true" attributes="NEUTRAL_LOCKOUT"/>
        <pointInfo name="Nominal Secondary Voltage"/>
        <pointInfo name="Open Delay Time" init="true"/>
        <pointInfo name="Open Op Count" init="true" attributes="OPEN_OPERATION_COUNT"/>
        <pointInfo name="Operation Failed" init="true"/>
        <pointInfo name="OV Op Count" init="true" attributes="OVER_VOLTAGE_COUNT"/>
        <pointInfo name="OV Threshold" init="true" attributes="OVER_VOLTAGE_THRESHOLD"/>
        <pointInfo name="OVUV Control" init="true" attributes="AUTO_VOLTAGE_CONTROL"/>
        <pointInfo name="Phase A Fundamental Current Average"/>
        <pointInfo name="Phase A Fundamental Voltage Average"/>
        <pointInfo name="Phase A Reverse Power Flow"/>
        <pointInfo name="Phase A Total Current Average"/>
        <pointInfo name="Phase A Total Voltage Average"/>
        <pointInfo name="Phase B Fundamental Current Average"/>
        <pointInfo name="Phase B Fundamental Voltage Average"/>
        <pointInfo name="Phase B Reverse Power Flow"/>
        <pointInfo name="Phase B Total Current Average"/>
        <pointInfo name="Phase B Total Voltage Average"/>
        <pointInfo name="Phase C Fundamental Current Average"/>
        <pointInfo name="Phase C Fundamental Voltage Average"/>
        <pointInfo name="Phase C Reverse Power Flow"/>
        <pointInfo name="Phase C Total Current Average"/>
        <pointInfo name="Phase C Total Voltage Average"/>
        <pointInfo name="Re-Close Delay Time" init="true"/>
        <pointInfo name="Real Time Clock Battery Failure" init="true"/>
        <pointInfo name="Reclose Block" init="true" attributes="RECLOSE_BLOCKED"/>
        <pointInfo name="Relay Sense Failed" init="true"/>
        <pointInfo name="Remote Control Mode" init="true"/>
        <pointInfo name="SCADA Override" init="true" attributes="SCADA_OVERRIDE_MODE"/>
        <pointInfo name="SCADA Override Clear" attributes="SCADA_OVERRIDE_CLEAR"/>
        <pointInfo name="SCADA Override Countdown Timer" attributes="SCADA_OVERRIDE_COUNTDOWN_TIMER"/>
        <pointInfo name="SCADA Override Heartbeat" attributes="SCADA_OVERRIDE_HEARTBEAT"/>
        <pointInfo name="SCADA Override Release Time"/>
        <pointInfo name="SCADA Override Time Remaining"/>
        <pointInfo name="SCADA Override Type"/>
        <pointInfo name="Serial Number" init="true" attributes="SERIAL_NUMBER"/>
        <pointInfo name="Temperature" init="true"/>
        <pointInfo name="Temperature High" init="true"/>
        <pointInfo name="Temperature Low" init="true"/>
        <pointInfo name="Three-Phase Current Average Interval"/>
        <pointInfo name="Three-Phase Voltage Average Interval"/>
        <pointInfo name="Total Op Count" init="true" attributes="TOTAL_OPERATION_COUNT"/>
        <pointInfo name="UDP Port" init="true" attributes="UDP_PORT"/>
        <pointInfo name="UV Op Count" init="true" attributes="UNDER_VOLTAGE_COUNT"/>
        <pointInfo name="UV Threshold" init="true" attributes="UNDER_VOLTAGE_THRESHOLD"/>
        <pointInfo name="VAR Control Total Voltage"/>
        <pointInfo name="VAr Reverse Power Flow"/>
        <pointInfo name="Voltage Control Flags" init="true" attributes="VOLTAGE_CONTROL"/>
        <pointInfo name="Va Secondary"/>
        <pointInfo name="Vb Secondary"/>
        <pointInfo name="Vc Secondary"/>
    </pointInfos>
    <commands>
        <command name="Integrity Scan">
            <cmd text="scan integrity"/>
            <point name="Serial Number"/>
            <point name="Last Control Reason"/>
            <point name="Ignored Control Reason"/>
            <point name="Capacitor Bank State"/>
            <point name="UDP Port"/>
            <point name="IP Address"/>
            <point name="Firmware Version"/>
        </command>
    </commands>
</pao>
